====================================================================================================
[1mParsed configuration from: /Users/pleiadian53/work/meta-spliceai/meta_spliceai/system/config.ini[0m
====================================================================================================
==========================================
[1m[info] Initializing SpliceIO singleton ...[0m
==========================================
Splice sites file: /Users/pleiadian53/work/meta-spliceai/data/ensembl/splice_sites_enhanced.tsv
FASTA file: /Users/pleiadian53/work/meta-spliceai/data/ensembl/Homo_sapiens.GRCh38.dna.primary_assembly.fa
================================================================================
CONSENSUS MOTIF ANALYSIS
================================================================================

📂 Loading splice sites from: /Users/pleiadian53/work/meta-spliceai/data/ensembl/splice_sites_enhanced.tsv
   Total splice sites: 2,829,398

📂 Loading FASTA file: /Users/pleiadian53/work/meta-spliceai/data/ensembl/Homo_sapiens.GRCh38.dna.primary_assembly.fa

   Donor sites: 1,414,699
   Acceptor sites: 1,414,699

================================================================================
DONOR SITE ANALYSIS: MAG|GTRAGT (9-mer)
================================================================================

🔄 Extracting donor motifs...
   Processed 50,000 / 1,414,699 donor sites...
   Processed 100,000 / 1,414,699 donor sites...
   Processed 150,000 / 1,414,699 donor sites...
   Processed 200,000 / 1,414,699 donor sites...
   Processed 250,000 / 1,414,699 donor sites...
   Processed 300,000 / 1,414,699 donor sites...
   Processed 350,000 / 1,414,699 donor sites...
   Processed 400,000 / 1,414,699 donor sites...
   Processed 450,000 / 1,414,699 donor sites...
   Processed 500,000 / 1,414,699 donor sites...
   Processed 550,000 / 1,414,699 donor sites...
   Processed 600,000 / 1,414,699 donor sites...
   Processed 650,000 / 1,414,699 donor sites...
   Processed 700,000 / 1,414,699 donor sites...
   Processed 750,000 / 1,414,699 donor sites...
   Processed 800,000 / 1,414,699 donor sites...
   Processed 850,000 / 1,414,699 donor sites...
   Processed 900,000 / 1,414,699 donor sites...
   Processed 950,000 / 1,414,699 donor sites...
   Processed 1,000,000 / 1,414,699 donor sites...
   Processed 1,050,000 / 1,414,699 donor sites...
   Processed 1,100,000 / 1,414,699 donor sites...
   Processed 1,150,000 / 1,414,699 donor sites...
   Processed 1,200,000 / 1,414,699 donor sites...
   Processed 1,250,000 / 1,414,699 donor sites...
   Processed 1,300,000 / 1,414,699 donor sites...
   Processed 1,350,000 / 1,414,699 donor sites...
   Processed 1,400,000 / 1,414,699 donor sites...
   ✅ Extracted 1,414,699 donor motifs

📊 Calculating position-specific frequencies...

Donor Motif Frequencies (9-mer: positions -3 to +6):
Position: -3  -2  -1  | +1  +2  +3  +4  +5  +6
          Exon        | Intron
------------------------------------------------------------
 -3: A:0.34 C:0.35 G:0.19 T:0.12  → C (35.3%)
 -2: A:0.64 C:0.10 G:0.11 T:0.14  → A (64.3%)
 -1: A:0.10 C:0.03 G:0.80 T:0.07  → G (80.4%)
          --------------------------------------------------
 +1: A:0.00 C:0.00 G:1.00 T:0.00  → G (99.7%)
 +2: A:0.00 C:0.01 G:0.00 T:0.99  → T (98.7%)
 +3: A:0.61 C:0.03 G:0.33 T:0.03  → A (61.3%)
 +4: A:0.69 C:0.07 G:0.12 T:0.12  → A (68.9%)
 +5: A:0.09 C:0.06 G:0.77 T:0.08  → G (77.1%)
 +6: A:0.18 C:0.15 G:0.18 T:0.49  → T (48.8%)

Observed Consensus (≥50% frequency): NAG|GTAAGN
Expected Consensus:                   MAG|GTRAGT

Motifs matching MAG|GTRAGT: 56,670 / 1,414,699 (4.01%)
Motifs with GT at +1,+2:    1,393,685 / 1,414,699 (98.51%)
Motifs with GC at +1,+2:    15,878 / 1,414,699 (1.12%)

================================================================================
ACCEPTOR SITE ANALYSIS: Polypyrimidine Tract + AG
================================================================================

🔄 Extracting acceptor motifs...
   Processed 50,000 / 1,414,699 acceptor sites...
   Processed 100,000 / 1,414,699 acceptor sites...
   Processed 150,000 / 1,414,699 acceptor sites...
   Processed 200,000 / 1,414,699 acceptor sites...
   Processed 250,000 / 1,414,699 acceptor sites...
   Processed 300,000 / 1,414,699 acceptor sites...
   Processed 350,000 / 1,414,699 acceptor sites...
   Processed 400,000 / 1,414,699 acceptor sites...
   Processed 450,000 / 1,414,699 acceptor sites...
   Processed 500,000 / 1,414,699 acceptor sites...
   Processed 550,000 / 1,414,699 acceptor sites...
   Processed 600,000 / 1,414,699 acceptor sites...
   Processed 650,000 / 1,414,699 acceptor sites...
   Processed 700,000 / 1,414,699 acceptor sites...
   Processed 750,000 / 1,414,699 acceptor sites...
   Processed 800,000 / 1,414,699 acceptor sites...
   Processed 850,000 / 1,414,699 acceptor sites...
   Processed 900,000 / 1,414,699 acceptor sites...
   Processed 950,000 / 1,414,699 acceptor sites...
   Processed 1,000,000 / 1,414,699 acceptor sites...
   Processed 1,050,000 / 1,414,699 acceptor sites...
   Processed 1,100,000 / 1,414,699 acceptor sites...
   Processed 1,150,000 / 1,414,699 acceptor sites...
   Processed 1,200,000 / 1,414,699 acceptor sites...
   Processed 1,250,000 / 1,414,699 acceptor sites...
   Processed 1,300,000 / 1,414,699 acceptor sites...
   Processed 1,350,000 / 1,414,699 acceptor sites...
   Processed 1,400,000 / 1,414,699 acceptor sites...
   ✅ Extracted 1,414,699 acceptor motifs

📊 Calculating position-specific frequencies...

Acceptor Motif Frequencies (25-mer):
Positions -20 to -1 (intron), +1 to +2 (AG), +3 to +5 (exon)
--------------------------------------------------------------------------------
-20: A:0.23 C:0.24 G:0.15 T:0.38  → T (38.0%)
-19: A:0.22 C:0.24 G:0.15 T:0.39  → T (39.0%)
-18: A:0.20 C:0.25 G:0.15 T:0.41  → T (40.6%)
-17: A:0.18 C:0.25 G:0.14 T:0.42  → T (41.9%)
-16: A:0.16 C:0.26 G:0.14 T:0.44  → T (43.7%)
     ...
 -2: A:0.24 C:0.27 G:0.20 T:0.29  → T (28.9%)
 -1: A:0.06 C:0.64 G:0.01 T:0.30  → C (63.5%)
          -------------------------------------------------- (intron|exon boundary)
  A: A:1.00 C:0.00 G:0.00 T:0.00  → A (99.8%)
  G: A:0.00 C:0.00 G:1.00 T:0.00  → G (99.7%)
 +1: A:0.27 C:0.14 G:0.48 T:0.12  → G (47.6%)
 +2: A:0.25 C:0.19 G:0.19 T:0.37  → T (36.7%)
 +3: A:0.26 C:0.23 G:0.23 T:0.28  → T (27.7%)

📊 Polypyrimidine Tract Analysis (positions -20 to -3):
   Average pyrimidine (C+T) content: 74.9%
   Range: 62.1% to 84.5%

📊 AG Dinucleotide at boundary:
   Motifs with AG at positions 20-21: 1,409,482 / 1,414,699 (99.63%)

📊 YAG Motif Analysis (positions -1 + AG):
   Top 10 YAG motifs:
     CAG: 896,827 (63.39%) - Y:✓ AG:✓
     TAG: 418,831 (29.61%) - Y:✓ AG:✓
     AAG: 86,086 (6.09%) - Y:✗ AG:✓
     GAG: 7,738 (0.55%) - Y:✗ AG:✓
     CAC: 794 (0.06%) - Y:✓ AG:✗
     TAC: 673 (0.05%) - Y:✓ AG:✗
     AAA: 219 (0.02%) - Y:✗ AG:✗
     CTG: 185 (0.01%) - Y:✓ AG:✗
     AAC: 165 (0.01%) - Y:✗ AG:✗
     TTG: 158 (0.01%) - Y:✓ AG:✗

================================================================================
SUMMARY
================================================================================

✅ Donor Sites (MAG|GTRAGT):
   - Canonical GT at +1,+2: 98.51%
   - Non-canonical GC at +1,+2: 1.12%
   - Full MAG|GTRAGT match: 4.01%

✅ Acceptor Sites:
   - Average polypyrimidine content: 74.9%
   - AG dinucleotide at boundary: 99.63%

================================================================================
ANALYSIS COMPLETE
================================================================================
